<?xml version="1.0" encoding="UTF-8"?>
<?xml-stylesheet type="text/xsl" href="../xsl/grddl.xsl"?>
<saglasnost_za_imunizaciju xmlns="http://ftn.uns.ac.rs/vakcina/saglasnost"
                           xmlns:xsi="http://www.w3.org/2001/XMLSchema-instance"
                           xmlns:pred="http://www.ftn.uns.ac.rs/rdf/saglasnost/predicate/"
                           xsi:schemaLocation="../schemas/saglanost_za_imunizaciju.xsd"
                           about="http://www.ftn.uns.ac.rs/rdf/saglasnost/123"
                           id="123" rel="pred:potvrda"
                           href="http://www.ftn.uns.ac.rs/rdf/potvrda/123">
    <licni_podaci>
        <drzavljanstvo>
            <srpsko>
                <JMBG property="pred:jmbg">0808999742049</JMBG>
            </srpsko>
        </drzavljanstvo>
        <prezime>Petrovic</prezime>
        <ime>Pera</ime>
        <ime_roditelja>Pera</ime_roditelja>
        <pol>M</pol>
        <datum_rodjenja>1999-02-02</datum_rodjenja>
        <mesto_rodjenja>Novi sad</mesto_rodjenja>
        <adresa>
            <ulica_broj>43</ulica_broj>
            <mesto_naselje>Novi Sad</mesto_naselje>
            <opstina_grad>Novi Sad</opstina_grad>
        </adresa>
        <fiksni_broj>011134134</fiksni_broj>
        <mobilni_broj>069123123</mobilni_broj>
        <email>pera.petrovic@gmail.com</email>
        <radni_status>zaposlen</radni_status>
        <zanimanje_zaposlenog>prosveta</zanimanje_zaposlenog>
        <korisnik_soc_zastite>
            <naziv_opstine>Novi Sad</naziv_opstine>
        </korisnik_soc_zastite>
    </licni_podaci>
    <saglasnost>
        <naziv_leka>Brufen</naziv_leka>
    </saglasnost>
    <potpis>PPera</potpis>
    <datum property="pred:datum">2021-12-12</datum>
    <evidencija_o_vakcinaciji>
        <zdravstvena_ustanova>Bolnica Novi Sad</zdravstvena_ustanova>
        <vakcinijski_punkt>123</vakcinijski_punkt>
        <lekar>
            <ime>Mara</ime>
            <prezime>Maric</prezime>
            <faksimil>test</faksimil>
            <broj_telefona>06123123123</broj_telefona>
        </lekar>
        <tabela_vakcinisanja>
            <vakcinisanje>
                <naziv_vakcine property="pred:vakcina">Pfizer-BioNTech</naziv_vakcine>
                <datum_davanja>2021-12-12</datum_davanja>
                <nacin_davanja>test</nacin_davanja>
                <ekstremitet>leva_ruka</ekstremitet>
                <serija_vakcine>123123</serija_vakcine>
                <proizvodjac >Pfizer-BioNTech</proizvodjac>
                <nezeljena_reakcija>Nema</nezeljena_reakcija>
                <potpis_lekara>MMara</potpis_lekara>
                <privremene_kontraindikacije>
                    <datum>2021-12-12</datum>
                    <dijagnoza>Nema</dijagnoza>
                </privremene_kontraindikacije>
            </vakcinisanje>
        </tabela_vakcinisanja>
    </evidencija_o_vakcinaciji>
</saglasnost_za_imunizaciju>